{
  "ledger_id": "RNS-C2S-20260919-001",
  "source_scope": {
    "description": "2026-09-19 Ready & Set resume scope: current user resume/C2S instruction, latest 2026-09-19 Ready & Set handoff recovered from Library, live TAKY main/C2S rules, live Ready-Set PR/branch/runtime/tests, and live Netlify staging metadata inspected during this turn.",
    "coverage_status": "RECOVERED_SCOPE_COMPLETE",
    "unavailable_ranges": []
  },
  "atoms": [
    {
      "atom_id": "RNS-C2S-001",
      "type": "REQUIREMENT",
      "material": true,
      "source_pointer": "conversation:2026-09-19:user:resume-c2s-readyset",
      "actor": "USER",
      "content": "Resume Ready & Set under the latest TAKY governance, execute C2S, and continue implementation from the actual current state rather than reconstructing from memory.",
      "scope": "PROJECT",
      "why": "The user explicitly requested governed continuation and durable conversation-to-system compilation before further implementation.",
      "disposition": "ADOPT",
      "destination": "Ready-Set/.taky/tasks/RNS-P0-STAGING-DEVICE-VALIDATION-001.md",
      "implementation_status": "REFLECTED",
      "verification_status": "VERIFIED_CURRENT_TURN"
    },
    {
      "atom_id": "RNS-C2S-002",
      "type": "OUTCOME",
      "material": true,
      "source_pointer": "github:TAKY:main@a101953d94715c800a122c147e87caf7836210b5",
      "actor": "SYSTEM",
      "content": "The live TAKY main inspected for this resume includes canonical TKY-C2S-001 and the C2S runtime activation specialization.",
      "scope": "GLOBAL",
      "why": "Establishes the governing canonical baseline actually used for this resumed work.",
      "disposition": "PRESERVE",
      "destination": "MASTER/CONVERSATION_TO_SYSTEM_PROTOCOL.md",
      "evidence": [
        "OS/C2S_RUNTIME_ACTIVATION.md",
        "MASTER/RULE_REGISTRY.json"
      ],
      "implementation_status": "CANONICAL_EXISTING",
      "verification_status": "LIVE_REPO_VERIFIED"
    },
    {
      "atom_id": "RNS-C2S-003",
      "type": "OUTCOME",
      "material": true,
      "source_pointer": "github:Ready-Set:PR#4@58233891cb0411eacd3e24dc76b47ecc8f10378e",
      "actor": "SYSTEM",
      "content": "Before this turn's governance-only task-file commit, the verified Ready & Set implementation baseline was PR #4 on taky/exploration-journey-2026-09-18 at 58233891..., with all five inspected workflow runs successful.",
      "scope": "PROJECT",
      "why": "Separates verified source/CI implementation state from later staging/device verification.",
      "disposition": "PRESERVE",
      "destination": "Ready-Set/.taky/tasks/RNS-P0-STAGING-DEVICE-VALIDATION-001.md",
      "evidence": [
        "Ready First Run Parent Activation Contract: SUCCESS",
        "Ready Parent Capture Contract: SUCCESS",
        "Ready Homework Analysis Contract: SUCCESS",
        "Ready Foundation Assignment Bridge Contract: SUCCESS",
        "Ready Exploration Journey Contract: SUCCESS"
      ],
      "implementation_status": "SOURCE_IMPLEMENTED",
      "verification_status": "CI_VERIFIED_DEVICE_UNVERIFIED"
    },
    {
      "atom_id": "RNS-C2S-004",
      "type": "CONSTRAINT",
      "material": true,
      "source_pointer": "library:Ready_Set_HANDOFF_2026-09-19(1).md + current task authority",
      "actor": "USER+SYSTEM",
      "content": "Ready & Set main merge and production deployment remain blocked until explicit human approval.",
      "scope": "PROJECT",
      "why": "Prevents staging/device validation work from silently becoming a production release.",
      "disposition": "PRESERVE",
      "destination": "Ready-Set/.taky/tasks/RNS-P0-STAGING-DEVICE-VALIDATION-001.md",
      "implementation_status": "ACTIVE_GATE",
      "verification_status": "VERIFIED"
    },
    {
      "atom_id": "RNS-C2S-005",
      "type": "DECISION",
      "material": true,
      "source_pointer": "recovered-ready-handoff:confirmed-timer-ui",
      "actor": "USER",
      "content": "Preserve the confirmed Ready & Set timer UI: yellow focus field, '그냥! 지금 하면 돼!', full analog clock, mission label, remaining/target time, pause, '완료했어요', BGM, and conditional REC.",
      "scope": "PROJECT",
      "why": "Functional/runtime hardening must not destabilize already confirmed visual authority.",
      "disposition": "PRESERVE",
      "destination": "Ready-Set/.taky/tasks/RNS-P0-STAGING-DEVICE-VALIDATION-001.md",
      "affects": [
        "Ready-Set/ready-stage-d-base-v1.js",
        "Ready-Set/ready-base-runtime-v1.js",
        "Ready-Set/ready-recording-v1.js"
      ],
      "implementation_status": "SOURCE_PRESENT",
      "verification_status": "SOURCE_AND_CONTRACT_VERIFIED"
    },
    {
      "atom_id": "RNS-C2S-006",
      "type": "REJECTION",
      "material": true,
      "source_pointer": "recovered-ready-handoff:rejected-ui-authority",
      "actor": "USER",
      "content": "Focus Mode, Time Attack, old Golden assets/contracts, and rejected ready-focus-tools-v1.js are not current Ready & Set UI authority and must not be revived.",
      "scope": "PROJECT",
      "why": "Prevents historical/rejected UI from being reintroduced during repair or staging work.",
      "disposition": "PRESERVE",
      "destination": "Ready-Set/.taky/tasks/RNS-P0-STAGING-DEVICE-VALIDATION-001.md",
      "supersedes": [
        "Ready-Set/.taky/tasks/RNS-P0-FOCUS-TIMER-GOLDEN-001.md"
      ],
      "implementation_status": "ACTIVE_GUARD",
      "verification_status": "VERIFIED"
    },
    {
      "atom_id": "RNS-C2S-007",
      "type": "OPEN",
      "material": true,
      "source_pointer": "conversation-history:2026-09-18:weekly-daily-ui-review",
      "actor": "USER",
      "content": "Weekly schedule should be concise, daily should be vertical, and both should use the explorer concept; however the final weekly/daily visual design is not yet locked because the preferred concept still felt visually tiring and weekly review remained unfinished.",
      "scope": "PROJECT",
      "why": "Prevents implementation from falsely treating an exploratory mockup direction as approved final UI.",
      "disposition": "HOLD",
      "destination": "Ready & Set weekly/daily UI design backlog",
      "affects": [
        "Ready & Set schedule/planner presentation"
      ],
      "implementation_status": "NOT_FINALIZED",
      "verification_status": "OPEN_USER_DESIGN_LOCK"
    },
    {
      "atom_id": "RNS-C2S-008",
      "type": "EVIDENCE",
      "material": true,
      "source_pointer": "netlify:ready-set-staging-taky:deploy:6aa698853e51c883dd6a69c2",
      "actor": "SYSTEM",
      "content": "The current Netlify staging alias points to an upload-style deploy created on 2026-09-13; commit_ref and branch are null, so it is not evidence that the current Ready & Set safe-branch implementation is deployed.",
      "scope": "TOOL",
      "why": "Actual iPhone validation would otherwise test stale or untraceable runtime code and produce invalid release evidence.",
      "disposition": "PRESERVE",
      "destination": "Ready-Set/.taky/tasks/RNS-P0-STAGING-DEVICE-VALIDATION-001.md",
      "evidence": [
        "site_id=63bd9a17-909b-4bac-8cb3-06437a628896",
        "deploy_id=6aa698853e51c883dd6a69c2",
        "created_at=2026-09-13T12:35:17.556Z",
        "title=Deploy triggered by upload",
        "commit_ref=null",
        "branch=null"
      ],
      "implementation_status": "STAGING_STALE_OR_UNTRACEABLE",
      "verification_status": "LIVE_NETLIFY_VERIFIED"
    },
    {
      "atom_id": "RNS-C2S-009",
      "type": "STRATEGY",
      "material": true,
      "source_pointer": "conversation:2026-09-19:derived-next-execution-gate",
      "actor": "USER+SYSTEM",
      "content": "The next implementation sequence is exact safe-branch staging parity, then actual iPhone/PWA validation, then only observed-gap fixes, regression validation, and finally human approval before production promotion.",
      "scope": "PROJECT",
      "why": "This is the smallest high-value missing dimension between current source/CI implementation and trustworthy release readiness.",
      "disposition": "ADOPT",
      "destination": "Ready-Set/.taky/tasks/RNS-P0-STAGING-DEVICE-VALIDATION-001.md",
      "depends_on": [
        "RNS-C2S-008"
      ],
      "implementation_status": "TASK_CONTRACT_CREATED",
      "verification_status": "VERIFIED"
    },
    {
      "atom_id": "RNS-C2S-010",
      "type": "OUTCOME",
      "material": true,
      "source_pointer": "github-actions:Ready-Set:run:35398513917",
      "actor": "SYSTEM",
      "content": "A deterministic exact-head staging source package path is now established for the Ready & Set safe branch. The current package was produced from head 3d96878ada0458196ff8bfc68fdcf7087ea4d1ca and includes STAGING_SOURCE_MANIFEST.json plus a verified SHA-256 for the deployable site ZIP.",
      "scope": "TOOL",
      "why": "This closes the earlier source-traceability gap and prevents stale/manual staging uploads from being mistaken for the current safe-branch tree.",
      "disposition": "ADOPT",
      "destination": "Ready-Set/.github/workflows/ready-staging-source-package.yml",
      "evidence": [
        "workflow_run=35398513917",
        "artifact_id=10569796467",
        "sourceCommit=3d96878ada0458196ff8bfc68fdcf7087ea4d1ca",
        "appVersion=0.9.4-rc25",
        "cacheVersion=ready-set-v094-rev07-staging28-runtime-hardening-v1",
        "siteZipSha256=48b9961961b839202ca910e68310c8c06b54cf32e01b6fd45bc81313abe8544a"
      ],
      "implementation_status": "SOURCE_PACKAGE_READY",
      "verification_status": "ARTIFACT_MANIFEST_AND_HASH_VERIFIED"
    },
    {
      "atom_id": "RNS-C2S-011",
      "type": "OPEN",
      "material": true,
      "source_pointer": "github-actions:Ready-Set:run:35398395537 + netlify:ready-set-staging-taky",
      "actor": "SYSTEM",